{
  "project_name": "NeonSet",
  "seed_prompt": "cyberpunk neon ribbons with synchronized pulse bursts",
  "style": "cyberpunk",
  "duration_seconds": 8,
  "frame_rate": 60,
  "resolution": "1920x1080",
  "loop_type": "seamless",
  "tempo_bpm": 120,
  "audio_reactive": true,
  "color_palette": ["#00e5ff", "#ff2ed1", "#7928ff"],
  "asset_type": "shader_loop",
  "export_targets": ["mp4", "shadergraph", "glb", "uasset"],
  "variants": {
    "count": 3,
    "diversity": "medium"
  },
  "constraints": {
    "max_triangles": 250000,
    "max_texture_size": 4096,
    "max_file_size_mb": 250,
    "gpu_budget_ms": 12
  },
  "metadata": {
    "tags": ["cyberpunk", "neon", "bpm-sync"],
    "license": "royalty-free",
    "author": "VJ Studio Team",
    "project_version": "1.0.0"
  },
  "callbacks": {
    "webhook_url": null,
    "notify_on_complete": false
  }
}
